{
  "authority": "applied",
  "contentVersion": "progression-rebalance-v1",
  "singleRiceCost": 5000,
  "gradeProbabilityMillionths": {
    "NORMAL": 500000,
    "RARE": 350000,
    "EPIC": 140000,
    "LEGENDARY": 10000
  },
  "starThresholdsByGrade": {
    "NORMAL": [
      1,
      480,
      720,
      1200,
      2400
    ],
    "RARE": [
      1,
      168,
      252,
      420,
      840
    ],
    "EPIC": [
      1,
      134,
      202,
      336,
      672
    ],
    "LEGENDARY": [
      1,
      2,
      3,
      5,
      10
    ]
  },
  "cosmetics": [
    {
      "cosmeticId": "cosmetic-001",
      "displayName": null,
      "imageUrl": null,
      "grade": "NORMAL",
      "slot": "HEAD",
      "setId": "cosmetic-set-01"
    },
    {
      "cosmeticId": "cosmetic-002",
      "displayName": null,
      "imageUrl": null,
      "grade": "NORMAL",
      "slot": "TOP",
      "setId": "cosmetic-set-01"
    },
    {
      "cosmeticId": "cosmetic-003",
      "displayName": null,
      "imageUrl": null,
      "grade": "NORMAL",
      "slot": "BOTTOM",
      "setId": "cosmetic-set-01"
    },
    {
      "cosmeticId": "cosmetic-004",
      "displayName": null,
      "imageUrl": null,
      "grade": "NORMAL",
      "slot": "GLOVES",
      "setId": "cosmetic-set-01"
    },
    {
      "cosmeticId": "cosmetic-005",
      "displayName": null,
      "imageUrl": null,
      "grade": "NORMAL",
      "slot": "SHOES",
      "setId": "cosmetic-set-01"
    },
    {
      "cosmeticId": "cosmetic-006",
      "displayName": null,
      "imageUrl": null,
      "grade": "NORMAL",
      "slot": "CAPE",
      "setId": "cosmetic-set-01"
    },
    {
      "cosmeticId": "cosmetic-007",
      "displayName": null,
      "imageUrl": null,
      "grade": "NORMAL",
      "slot": "HEAD",
      "setId": "cosmetic-set-02"
    },
    {
      "cosmeticId": "cosmetic-008",
      "displayName": null,
      "imageUrl": null,
      "grade": "NORMAL",
      "slot": "TOP",
      "setId": "cosmetic-set-02"
    },
    {
      "cosmeticId": "cosmetic-009",
      "displayName": null,
      "imageUrl": null,
      "grade": "NORMAL",
      "slot": "BOTTOM",
      "setId": "cosmetic-set-02"
    },
    {
      "cosmeticId": "cosmetic-010",
      "displayName": null,
      "imageUrl": null,
      "grade": "NORMAL",
      "slot": "GLOVES",
      "setId": "cosmetic-set-02"
    },
    {
      "cosmeticId": "cosmetic-011",
      "displayName": null,
      "imageUrl": null,
      "grade": "NORMAL",
      "slot": "SHOES",
      "setId": "cosmetic-set-02"
    },
    {
      "cosmeticId": "cosmetic-012",
      "displayName": null,
      "imageUrl": null,
      "grade": "NORMAL",
      "slot": "CAPE",
      "setId": "cosmetic-set-02"
    },
    {
      "cosmeticId": "cosmetic-013",
      "displayName": null,
      "imageUrl": null,
      "grade": "NORMAL",
      "slot": "HEAD",
      "setId": "cosmetic-set-03"
    },
    {
      "cosmeticId": "cosmetic-014",
      "displayName": null,
      "imageUrl": null,
      "grade": "NORMAL",
      "slot": "TOP",
      "setId": "cosmetic-set-03"
    },
    {
      "cosmeticId": "cosmetic-015",
      "displayName": null,
      "imageUrl": null,
      "grade": "NORMAL",
      "slot": "BOTTOM",
      "setId": "cosmetic-set-03"
    },
    {
      "cosmeticId": "cosmetic-016",
      "displayName": null,
      "imageUrl": null,
      "grade": "NORMAL",
      "slot": "GLOVES",
      "setId": "cosmetic-set-03"
    },
    {
      "cosmeticId": "cosmetic-017",
      "displayName": null,
      "imageUrl": null,
      "grade": "NORMAL",
      "slot": "SHOES",
      "setId": "cosmetic-set-03"
    },
    {
      "cosmeticId": "cosmetic-018",
      "displayName": null,
      "imageUrl": null,
      "grade": "NORMAL",
      "slot": "CAPE",
      "setId": "cosmetic-set-03"
    },
    {
      "cosmeticId": "cosmetic-019",
      "displayName": null,
      "imageUrl": null,
      "grade": "NORMAL",
      "slot": "HEAD",
      "setId": "cosmetic-set-04"
    },
    {
      "cosmeticId": "cosmetic-020",
      "displayName": null,
      "imageUrl": null,
      "grade": "NORMAL",
      "slot": "TOP",
      "setId": "cosmetic-set-04"
    },
    {
      "cosmeticId": "cosmetic-021",
      "displayName": null,
      "imageUrl": null,
      "grade": "NORMAL",
      "slot": "BOTTOM",
      "setId": "cosmetic-set-04"
    },
    {
      "cosmeticId": "cosmetic-022",
      "displayName": null,
      "imageUrl": null,
      "grade": "NORMAL",
      "slot": "GLOVES",
      "setId": "cosmetic-set-04"
    },
    {
      "cosmeticId": "cosmetic-023",
      "displayName": null,
      "imageUrl": null,
      "grade": "NORMAL",
      "slot": "SHOES",
      "setId": "cosmetic-set-04"
    },
    {
      "cosmeticId": "cosmetic-024",
      "displayName": null,
      "imageUrl": null,
      "grade": "NORMAL",
      "slot": "CAPE",
      "setId": "cosmetic-set-04"
    },
    {
      "cosmeticId": "cosmetic-025",
      "displayName": null,
      "imageUrl": null,
      "grade": "RARE",
      "slot": "HEAD",
      "setId": "cosmetic-set-05"
    },
    {
      "cosmeticId": "cosmetic-026",
      "displayName": null,
      "imageUrl": null,
      "grade": "RARE",
      "slot": "TOP",
      "setId": "cosmetic-set-05"
    },
    {
      "cosmeticId": "cosmetic-027",
      "displayName": null,
      "imageUrl": null,
      "grade": "RARE",
      "slot": "BOTTOM",
      "setId": "cosmetic-set-05"
    },
    {
      "cosmeticId": "cosmetic-028",
      "displayName": null,
      "imageUrl": null,
      "grade": "RARE",
      "slot": "GLOVES",
      "setId": "cosmetic-set-05"
    },
    {
      "cosmeticId": "cosmetic-029",
      "displayName": null,
      "imageUrl": null,
      "grade": "RARE",
      "slot": "SHOES",
      "setId": "cosmetic-set-05"
    },
    {
      "cosmeticId": "cosmetic-030",
      "displayName": null,
      "imageUrl": null,
      "grade": "RARE",
      "slot": "CAPE",
      "setId": "cosmetic-set-05"
    },
    {
      "cosmeticId": "cosmetic-031",
      "displayName": null,
      "imageUrl": null,
      "grade": "RARE",
      "slot": "HEAD",
      "setId": "cosmetic-set-06"
    },
    {
      "cosmeticId": "cosmetic-032",
      "displayName": null,
      "imageUrl": null,
      "grade": "RARE",
      "slot": "TOP",
      "setId": "cosmetic-set-06"
    },
    {
      "cosmeticId": "cosmetic-033",
      "displayName": null,
      "imageUrl": null,
      "grade": "RARE",
      "slot": "BOTTOM",
      "setId": "cosmetic-set-06"
    },
    {
      "cosmeticId": "cosmetic-034",
      "displayName": null,
      "imageUrl": null,
      "grade": "RARE",
      "slot": "GLOVES",
      "setId": "cosmetic-set-06"
    },
    {
      "cosmeticId": "cosmetic-035",
      "displayName": null,
      "imageUrl": null,
      "grade": "RARE",
      "slot": "SHOES",
      "setId": "cosmetic-set-06"
    },
    {
      "cosmeticId": "cosmetic-036",
      "displayName": null,
      "imageUrl": null,
      "grade": "RARE",
      "slot": "CAPE",
      "setId": "cosmetic-set-06"
    },
    {
      "cosmeticId": "cosmetic-037",
      "displayName": null,
      "imageUrl": null,
      "grade": "RARE",
      "slot": "HEAD",
      "setId": "cosmetic-set-07"
    },
    {
      "cosmeticId": "cosmetic-038",
      "displayName": null,
      "imageUrl": null,
      "grade": "RARE",
      "slot": "TOP",
      "setId": "cosmetic-set-07"
    },
    {
      "cosmeticId": "cosmetic-039",
      "displayName": null,
      "imageUrl": null,
      "grade": "RARE",
      "slot": "BOTTOM",
      "setId": "cosmetic-set-07"
    },
    {
      "cosmeticId": "cosmetic-040",
      "displayName": null,
      "imageUrl": null,
      "grade": "RARE",
      "slot": "GLOVES",
      "setId": "cosmetic-set-07"
    },
    {
      "cosmeticId": "cosmetic-041",
      "displayName": null,
      "imageUrl": null,
      "grade": "RARE",
      "slot": "SHOES",
      "setId": "cosmetic-set-07"
    },
    {
      "cosmeticId": "cosmetic-042",
      "displayName": null,
      "imageUrl": null,
      "grade": "RARE",
      "slot": "CAPE",
      "setId": "cosmetic-set-07"
    },
    {
      "cosmeticId": "cosmetic-043",
      "displayName": null,
      "imageUrl": null,
      "grade": "EPIC",
      "slot": "HEAD",
      "setId": "cosmetic-set-08"
    },
    {
      "cosmeticId": "cosmetic-044",
      "displayName": null,
      "imageUrl": null,
      "grade": "EPIC",
      "slot": "TOP",
      "setId": "cosmetic-set-08"
    },
    {
      "cosmeticId": "cosmetic-045",
      "displayName": null,
      "imageUrl": null,
      "grade": "EPIC",
      "slot": "BOTTOM",
      "setId": "cosmetic-set-08"
    },
    {
      "cosmeticId": "cosmetic-046",
      "displayName": null,
      "imageUrl": null,
      "grade": "EPIC",
      "slot": "GLOVES",
      "setId": "cosmetic-set-08"
    },
    {
      "cosmeticId": "cosmetic-047",
      "displayName": null,
      "imageUrl": null,
      "grade": "EPIC",
      "slot": "SHOES",
      "setId": "cosmetic-set-08"
    },
    {
      "cosmeticId": "cosmetic-048",
      "displayName": null,
      "imageUrl": null,
      "grade": "EPIC",
      "slot": "CAPE",
      "setId": "cosmetic-set-08"
    },
    {
      "cosmeticId": "cosmetic-049",
      "displayName": null,
      "imageUrl": null,
      "grade": "EPIC",
      "slot": "HEAD",
      "setId": "cosmetic-set-09"
    },
    {
      "cosmeticId": "cosmetic-050",
      "displayName": null,
      "imageUrl": null,
      "grade": "EPIC",
      "slot": "TOP",
      "setId": "cosmetic-set-09"
    },
    {
      "cosmeticId": "cosmetic-051",
      "displayName": null,
      "imageUrl": null,
      "grade": "EPIC",
      "slot": "BOTTOM",
      "setId": "cosmetic-set-09"
    },
    {
      "cosmeticId": "cosmetic-052",
      "displayName": null,
      "imageUrl": null,
      "grade": "EPIC",
      "slot": "GLOVES",
      "setId": "cosmetic-set-09"
    },
    {
      "cosmeticId": "cosmetic-053",
      "displayName": null,